{
  "$schema": "https://json-schema.org/draft/2020-12/schema",
  "$id": "https://ledgerly.dev/contracts/embed-policy-response.schema.json",
  "title": "EmbedPolicyResponse",
  "description": "What `ai` returns from `POST /embed-policy` — the policy document split into chunks, each with its embedding vector. `api` persists these as `policy_chunk` rows.",
  "type": "object",
  "additionalProperties": false,
  "required": ["policy_document_id", "model", "embedding_dimensions", "chunks"],
  "properties": {
    "policy_document_id": {
      "type": "string",
      "format": "uuid"
    },
    "model": {
      "description": "Identifier of the embedding model that produced every vector in this response, so a later dimension or model change is traceable per chunk.",
      "type": "string",
      "minLength": 1
    },
    "embedding_dimensions": {
      "description": "Length of every `embedding` array in `chunks`. Never assumed by `api` — always read from here.",
      "type": "integer",
      "minimum": 1
    },
    "chunks": {
      "type": "array",
      "items": {
        "type": "object",
        "additionalProperties": false,
        "required": ["chunk_index", "chunk_text", "embedding"],
        "properties": {
          "chunk_index": {
            "description": "0-based position of this chunk within the document, so retrieval results can be traced back to their place in the source text.",
            "type": "integer",
            "minimum": 0
          },
          "chunk_text": {
            "type": "string",
            "minLength": 1
          },
          "embedding": {
            "type": "array",
            "minItems": 1,
            "items": {
              "type": "number"
            }
          }
        }
      }
    }
  }
}
